{
  "schemaVersion": 1,
  "capsuleId": "0d95b7c1-7ce9-4a91-aea2-b64707a05c9f",
  "revision": 1,
  "durationMs": 18200,
  "status": "queued",
  "audioFile": "audio.m4a",
  "rawTextFile": null,
  "polishedTextFile": null,
  "errorStage": null,
  "error": null,
  "attempts": 0,
  "engine": "whisper.cpp",
  "model": "tiny"
}
